{
  "deck_id": "official_verbs_adjectives",
  "version": 4,
  "name": "基本の動詞・形容詞",
  "author": {
    "id": "official_hanco",
    "nickname": "ピヨキー 公式"
  },
  "official": true,
  "type": "word",
  "level": 2,
  "tags": [
    "基礎単語",
    "動詞",
    "公式"
  ],
  "created_at": "2026-02-05T00:00:00Z",
  "updated_at": "2026-08-11T00:00:00Z",
  "items": [
    {
      "id": "i_001",
      "ko": "예쁘다",
      "reading_ja": "イェップダ",
      "meaning_ja": "きれいだ",
      "audio": "audio/ko_f62ff8982d788e72028f.mp3",
      "localizations": {
        "en": {
          "meaning": "to be pretty",
          "reading": "yeppeuda"
        }
      }
    },
    {
      "id": "i_002",
      "ko": "재미있다",
      "reading_ja": "チェミイッタ",
      "meaning_ja": "面白い",
      "audio": "audio/ko_e2360d9fd7642ddd6242.mp3",
      "localizations": {
        "en": {
          "meaning": "to be fun",
          "reading": "jaemiitda"
        }
      }
    },
    {
      "id": "i_003",
      "ko": "괜찮다",
      "reading_ja": "クェンチャンタ",
      "meaning_ja": "大丈夫だ",
      "audio": "audio/ko_b9a2699f824000e36e45.mp3",
      "localizations": {
        "en": {
          "meaning": "to be okay",
          "reading": "gwaenchanda"
        }
      }
    },
    {
      "id": "i_004",
      "ko": "가다",
      "reading_ja": "カダ",
      "meaning_ja": "行く",
      "audio": "audio/ko_233cb510410b09d69cdc.mp3",
      "localizations": {
        "en": {
          "meaning": "to go",
          "reading": "gada"
        }
      }
    },
    {
      "id": "i_005",
      "ko": "오다",
      "reading_ja": "オダ",
      "meaning_ja": "来る",
      "audio": "audio/ko_6fe577b99594f4a7bd8d.mp3",
      "localizations": {
        "en": {
          "meaning": "to come",
          "reading": "oda"
        }
      }
    },
    {
      "id": "i_006",
      "ko": "먹다",
      "reading_ja": "モクタ",
      "meaning_ja": "食べる",
      "audio": "audio/ko_9639f892bdddb53fc055.mp3",
      "localizations": {
        "en": {
          "meaning": "to eat",
          "reading": "meokda"
        }
      }
    },
    {
      "id": "i_007",
      "ko": "보다",
      "reading_ja": "ポダ",
      "meaning_ja": "見る",
      "audio": "audio/ko_6a45cf834264a5ec3611.mp3",
      "localizations": {
        "en": {
          "meaning": "to see",
          "reading": "boda"
        }
      }
    },
    {
      "id": "i_008",
      "ko": "하다",
      "reading_ja": "ハダ",
      "meaning_ja": "する",
      "audio": "audio/ko_505de0a2f6be73fa7758.mp3",
      "localizations": {
        "en": {
          "meaning": "to do",
          "reading": "hada"
        }
      }
    },
    {
      "id": "i_009",
      "ko": "좋다",
      "reading_ja": "チョタ",
      "meaning_ja": "良い",
      "audio": "audio/ko_86d0464f1c6da40233cd.mp3",
      "localizations": {
        "en": {
          "meaning": "to be good",
          "reading": "johda"
        }
      }
    },
    {
      "id": "i_010",
      "ko": "크다",
      "reading_ja": "クダ",
      "meaning_ja": "大きい",
      "audio": "audio/ko_d9eb2cf86baea9292578.mp3",
      "localizations": {
        "en": {
          "meaning": "to be big",
          "reading": "keuda"
        }
      }
    },
    {
      "id": "i_011",
      "ko": "작다",
      "reading_ja": "チャクタ",
      "meaning_ja": "小さい",
      "audio": "audio/ko_bc42f85bf5be37c92f7c.mp3",
      "localizations": {
        "en": {
          "meaning": "to be small",
          "reading": "jakda"
        }
      }
    },
    {
      "id": "i_012",
      "ko": "빠르다",
      "reading_ja": "パルダ",
      "meaning_ja": "速い",
      "audio": "audio/ko_904de91feaff572f721f.mp3",
      "localizations": {
        "en": {
          "meaning": "to be fast",
          "reading": "ppareuda"
        }
      }
    }
  ],
  "localizations": {
    "en": {
      "name": "Essential Verbs & Adjectives",
      "author_nickname": "typee Official",
      "tags": [
        "Essential Vocabulary",
        "Verbs",
        "Official"
      ]
    },
    "ko": {
      "name": "기본 동사·형용사",
      "author_nickname": "피요키 공식",
      "tags": [
        "기본 어휘",
        "동사",
        "공식"
      ]
    }
  }
}
