{
  "deck_id": "official_fun_flirty_chat",
  "version": 2,
  "name": "チャットでじわっとフラート",
  "author": {
    "id": "official_hanco",
    "nickname": "ピヨキー 公式"
  },
  "official": true,
  "type": "sentence",
  "level": 2,
  "tags": [
    "恋愛",
    "チャット",
    "会話",
    "公式"
  ],
  "created_at": "2026-04-26T00:00:00Z",
  "updated_at": "2026-08-11T00:00:00Z",
  "items": [
    {
      "id": "i_001",
      "ko": "좋은 밤 보내요",
      "reading_ja": "チョウン パム ポネヨ",
      "meaning_ja": "良い夜を過ごしてね",
      "audio": "audio/ko_0e1ca5b60c8fb5949263.mp3",
      "localizations": {
        "en": {
          "meaning": "Have a good night",
          "reading": "joheun bam bonaeyo"
        }
      }
    },
    {
      "id": "i_002",
      "ko": "내 꿈에 나와요",
      "reading_ja": "ネ クメ ナワヨ",
      "meaning_ja": "私の夢に出てきてね",
      "audio": "audio/ko_b7d737f1700bc75e7be7.mp3",
      "localizations": {
        "en": {
          "meaning": "Come visit me in my dreams",
          "reading": "nae kkume nawayo"
        }
      }
    },
    {
      "id": "i_003",
      "ko": "자꾸 생각나네요",
      "reading_ja": "チャック センガンナネヨ",
      "meaning_ja": "何度も思い出します",
      "audio": "audio/ko_00107f73cea3f791ef54.mp3",
      "localizations": {
        "en": {
          "meaning": "I keep thinking of you",
          "reading": "jakku saenggaknaneyo"
        }
      }
    },
    {
      "id": "i_004",
      "ko": "오늘 생각났어요",
      "reading_ja": "オヌル センガンナッソヨ",
      "meaning_ja": "今日、ふと思い出しました",
      "audio": "audio/ko_ae3c17a23beb5f707190.mp3",
      "localizations": {
        "en": {
          "meaning": "I thought of you today",
          "reading": "oneul saenggaknateoyo"
        }
      }
    },
    {
      "id": "i_005",
      "ko": "답장 기다렸어요",
      "reading_ja": "タプチャン キダリョッソヨ",
      "meaning_ja": "返信を待っていました",
      "audio": "audio/ko_986b4f437e9bc2dcd2c3.mp3",
      "localizations": {
        "en": {
          "meaning": "I was waiting for your reply",
          "reading": "dapjang gidaryeoteoyo"
        }
      }
    },
    {
      "id": "i_006",
      "ko": "목소리 듣고 싶어요",
      "reading_ja": "モクソリ トゥッコ シポヨ",
      "meaning_ja": "声が聞きたいです",
      "audio": "audio/ko_c847bee375de12c14c6e.mp3",
      "localizations": {
        "en": {
          "meaning": "I want to hear your voice",
          "reading": "moksori deutgo sipeoyo"
        }
      }
    },
    {
      "id": "i_007",
      "ko": "사진 보내 줘요",
      "reading_ja": "サジン ポネ ジョヨ",
      "meaning_ja": "写真を送ってください",
      "audio": "audio/ko_039600f35c0ba6a3e23f.mp3",
      "localizations": {
        "en": {
          "meaning": "Please send me a photo",
          "reading": "sajin bonae jwoyo"
        }
      }
    },
    {
      "id": "i_008",
      "ko": "많이 보고 싶어요",
      "reading_ja": "マニ ポゴ シポヨ",
      "meaning_ja": "とても会いたいです",
      "audio": "audio/ko_21c55dc07615366d4245.mp3",
      "localizations": {
        "en": {
          "meaning": "I miss you so much",
          "reading": "mani bogo sipeoyo"
        }
      }
    },
    {
      "id": "i_009",
      "ko": "오늘도 예쁘네요",
      "reading_ja": "オヌルド イェップネヨ",
      "meaning_ja": "今日もきれいですね",
      "audio": "audio/ko_b2ea84f415ab75a3f024.mp3",
      "localizations": {
        "en": {
          "meaning": "You look beautiful today too",
          "reading": "oneuldo yeppeuneyo"
        }
      }
    },
    {
      "id": "i_010",
      "ko": "보고 싶어서 왔어요",
      "reading_ja": "ポゴ シポソ ワッソヨ",
      "meaning_ja": "会いたくて来ました",
      "audio": "audio/ko_fcbfdc73849a32a124b9.mp3",
      "localizations": {
        "en": {
          "meaning": "I came because I missed you",
          "reading": "bogo sipeoseo wateoyo"
        }
      }
    },
    {
      "id": "i_011",
      "ko": "내일 시간 있어요",
      "reading_ja": "ネイル シガン イッソヨ",
      "meaning_ja": "明日、時間ありますか",
      "audio": "audio/ko_542ce278cff9349af58c.mp3",
      "localizations": {
        "en": {
          "meaning": "Are you free tomorrow?",
          "reading": "naeil sigan iteoyo"
        }
      }
    },
    {
      "id": "i_012",
      "ko": "같이 걷고 싶어요",
      "reading_ja": "カチ コッコ シポヨ",
      "meaning_ja": "一緒に歩きたいです",
      "audio": "audio/ko_4f63a8882e456be48c15.mp3",
      "localizations": {
        "en": {
          "meaning": "I want to walk with you",
          "reading": "gati geotgo sipeoyo"
        }
      }
    }
  ],
  "localizations": {
    "en": {
      "name": "Flirty Chat",
      "author_nickname": "typee Official",
      "tags": [
        "Romance",
        "Chat",
        "Conversation",
        "Official"
      ]
    },
    "ko": {
      "name": "은근한 플러팅 채팅",
      "author_nickname": "피요키 공식",
      "tags": [
        "연애",
        "채팅",
        "회화",
        "공식"
      ]
    }
  }
}
