{
  "deck_id": "official_daily_phrases",
  "version": 5,
  "name": "毎日使う短いフレーズ",
  "author": {
    "id": "official_hanco",
    "nickname": "ピヨキー 公式"
  },
  "official": true,
  "type": "sentence",
  "level": 2,
  "tags": [
    "日常",
    "会話",
    "公式"
  ],
  "created_at": "2026-02-10T00:00:00Z",
  "updated_at": "2026-08-11T00:00:00Z",
  "items": [
    {
      "id": "i_001",
      "ko": "행복하게 웃어요",
      "reading_ja": "ヘンボカゲ ウソヨ",
      "meaning_ja": "幸せに笑ってください",
      "audio": "audio/ko_6fdc7bb7300362161064.mp3",
      "localizations": {
        "en": {
          "meaning": "Please keep smiling",
          "reading": "haengbokhage uteoyo"
        }
      }
    },
    {
      "id": "i_002",
      "ko": "오늘 하루 어땠어요",
      "reading_ja": "オヌル ハル オテッソヨ",
      "meaning_ja": "今日はどうでしたか",
      "audio": "audio/ko_3d5c837b04c5c96abdc9.mp3",
      "localizations": {
        "en": {
          "meaning": "How was your day?",
          "reading": "oneul haru eottaeteoyo"
        }
      }
    },
    {
      "id": "i_003",
      "ko": "도와줘서 고마워요",
      "reading_ja": "トワジョソ コマウォヨ",
      "meaning_ja": "手伝ってくれてありがとう",
      "audio": "audio/ko_93359e815b10f4cc0c51.mp3",
      "localizations": {
        "en": {
          "meaning": "Thank you for helping me",
          "reading": "dowajwoseo gomawoyo"
        }
      }
    },
    {
      "id": "i_004",
      "ko": "다음에 또 말해요",
      "reading_ja": "タウメ ト マレヨ",
      "meaning_ja": "今度また話しましょう",
      "audio": "audio/ko_9d316b98cc23a6c60a96.mp3",
      "localizations": {
        "en": {
          "meaning": "Let's talk again next time",
          "reading": "daeume tto malhaeyo"
        }
      }
    },
    {
      "id": "i_005",
      "ko": "좋은 아침이에요",
      "reading_ja": "チョウン アチミエヨ",
      "meaning_ja": "おはようございます",
      "audio": "audio/ko_2636ae33c50ecd535eec.mp3",
      "localizations": {
        "en": {
          "meaning": "Good morning",
          "reading": "joheun achimieyo"
        }
      }
    },
    {
      "id": "i_006",
      "ko": "오늘 날씨가 좋아요",
      "reading_ja": "オヌル ナルシガ チョアヨ",
      "meaning_ja": "今日は天気が良いです",
      "audio": "audio/ko_69692b35d2956ecef6d8.mp3",
      "localizations": {
        "en": {
          "meaning": "The weather is nice today",
          "reading": "oneul nalssiga johayo"
        }
      }
    },
    {
      "id": "i_007",
      "ko": "점심 같이 먹어요",
      "reading_ja": "チョムシム カチ モゴヨ",
      "meaning_ja": "昼食を一緒に食べましょう",
      "audio": "audio/ko_f47d5583bb638f2468bd.mp3",
      "localizations": {
        "en": {
          "meaning": "Let's have lunch together",
          "reading": "jeomsim gati meokeoyo"
        }
      }
    },
    {
      "id": "i_008",
      "ko": "조금 피곤해요",
      "reading_ja": "チョグム ピゴネヨ",
      "meaning_ja": "少し疲れています",
      "audio": "audio/ko_0cd56b89a5dc5cfc4653.mp3",
      "localizations": {
        "en": {
          "meaning": "I'm a little tired",
          "reading": "jogeum pigonhaeyo"
        }
      }
    },
    {
      "id": "i_009",
      "ko": "지금 집에 가요",
      "reading_ja": "チグム チベ カヨ",
      "meaning_ja": "今家に帰ります",
      "audio": "audio/ko_4d02b867b0d6f62d2a2a.mp3",
      "localizations": {
        "en": {
          "meaning": "I'm going home now",
          "reading": "jigeum jipe gayo"
        }
      }
    },
    {
      "id": "i_010",
      "ko": "내일 다시 만나요",
      "reading_ja": "ネイル タシ マンナヨ",
      "meaning_ja": "明日また会いましょう",
      "audio": "audio/ko_5e51819ea3767b0d830f.mp3",
      "localizations": {
        "en": {
          "meaning": "See you again tomorrow",
          "reading": "naeil dasi mannayo"
        }
      }
    },
    {
      "id": "i_011",
      "ko": "천천히 말해 주세요",
      "reading_ja": "チョンチョニ マレ ジュセヨ",
      "meaning_ja": "ゆっくり話してください",
      "audio": "audio/ko_27c40a9aae491aa2b1b0.mp3",
      "localizations": {
        "en": {
          "meaning": "Please speak slowly",
          "reading": "cheoncheonhi malhae juseyo"
        }
      }
    },
    {
      "id": "i_012",
      "ko": "정말 재미있어요",
      "reading_ja": "チョンマル チェミイッソヨ",
      "meaning_ja": "本当に面白いです",
      "audio": "audio/ko_800414ade453b18789bf.mp3",
      "localizations": {
        "en": {
          "meaning": "It's really fun",
          "reading": "jeongmal jaemiiteoyo"
        }
      }
    }
  ],
  "localizations": {
    "en": {
      "name": "Everyday Short Phrases",
      "author_nickname": "typee Official",
      "tags": [
        "Everyday",
        "Conversation",
        "Official"
      ]
    },
    "ko": {
      "name": "매일 쓰는 짧은 표현",
      "author_nickname": "피요키 공식",
      "tags": [
        "일상",
        "회화",
        "공식"
      ]
    }
  }
}
