{
  "deck_id": "official_keyboard_start",
  "version": 4,
  "name": "はじめての2ボル式",
  "author": {
    "id": "official_hanco",
    "nickname": "ピヨキー 公式"
  },
  "official": true,
  "type": "word",
  "level": 1,
  "tags": [
    "入門",
    "キーボード",
    "公式"
  ],
  "created_at": "2026-01-06T00:00:00Z",
  "updated_at": "2026-08-11T00:00:00Z",
  "items": [
    {
      "id": "i_001",
      "ko": "라",
      "reading_ja": "ラ",
      "meaning_ja": "ㄹ + ㅏ",
      "audio": "audio/ko_d2121a871ca59e3b9a3a.mp3",
      "localizations": {
        "en": {
          "meaning": "ㄹ + ㅏ",
          "reading": "ra"
        }
      }
    },
    {
      "id": "i_002",
      "ko": "마",
      "reading_ja": "マ",
      "meaning_ja": "ㅁ + ㅏ",
      "audio": "audio/ko_0a8a81fee098641dbae5.mp3",
      "localizations": {
        "en": {
          "meaning": "ㅁ + ㅏ",
          "reading": "ma"
        }
      }
    },
    {
      "id": "i_003",
      "ko": "보",
      "reading_ja": "ポ",
      "meaning_ja": "ㅂ + ㅗ",
      "audio": "audio/ko_5bded62d50c159833b06.mp3",
      "localizations": {
        "en": {
          "meaning": "ㅂ + ㅗ",
          "reading": "bo"
        }
      }
    },
    {
      "id": "i_004",
      "ko": "소",
      "reading_ja": "ソ",
      "meaning_ja": "ㅅ + ㅗ",
      "audio": "audio/ko_8c57fafb0573bcf5d4c3.mp3",
      "localizations": {
        "en": {
          "meaning": "ㅅ + ㅗ",
          "reading": "so"
        }
      }
    },
    {
      "id": "i_005",
      "ko": "우",
      "reading_ja": "ウ",
      "meaning_ja": "ㅇ + ㅜ",
      "audio": "audio/ko_637bfe7928f524a3c40d.mp3",
      "localizations": {
        "en": {
          "meaning": "ㅇ + ㅜ",
          "reading": "u"
        }
      }
    },
    {
      "id": "i_006",
      "ko": "지",
      "reading_ja": "チ",
      "meaning_ja": "ㅈ + ㅣ",
      "audio": "audio/ko_32e608b594bece7ab3a3.mp3",
      "localizations": {
        "en": {
          "meaning": "ㅈ + ㅣ",
          "reading": "ji"
        }
      }
    },
    {
      "id": "i_007",
      "ko": "해",
      "reading_ja": "ヘ",
      "meaning_ja": "ㅎ + ㅐ",
      "audio": "audio/ko_b4ec4274b7799f1f17e5.mp3",
      "localizations": {
        "en": {
          "meaning": "ㅎ + ㅐ",
          "reading": "hae"
        }
      }
    },
    {
      "id": "i_008",
      "ko": "가",
      "reading_ja": "カ",
      "meaning_ja": "ㄱ + ㅏ",
      "audio": "audio/ko_64ee5293d31bc58b72d7.mp3",
      "localizations": {
        "en": {
          "meaning": "ㄱ + ㅏ",
          "reading": "ga"
        }
      }
    },
    {
      "id": "i_009",
      "ko": "나",
      "reading_ja": "ナ",
      "meaning_ja": "ㄴ + ㅏ",
      "audio": "audio/ko_1098bbe54520ab2a367c.mp3",
      "localizations": {
        "en": {
          "meaning": "ㄴ + ㅏ",
          "reading": "na"
        }
      }
    },
    {
      "id": "i_010",
      "ko": "다",
      "reading_ja": "タ",
      "meaning_ja": "ㄷ + ㅏ",
      "audio": "audio/ko_822b7db6f6886f572413.mp3",
      "localizations": {
        "en": {
          "meaning": "ㄷ + ㅏ",
          "reading": "da"
        }
      }
    },
    {
      "id": "i_011",
      "ko": "라",
      "reading_ja": "ラ",
      "meaning_ja": "ㄹ + ㅏ",
      "audio": "audio/ko_d2121a871ca59e3b9a3a.mp3",
      "localizations": {
        "en": {
          "meaning": "ㄹ + ㅏ",
          "reading": "ra"
        }
      }
    },
    {
      "id": "i_012",
      "ko": "마",
      "reading_ja": "マ",
      "meaning_ja": "ㅁ + ㅏ",
      "audio": "audio/ko_0a8a81fee098641dbae5.mp3",
      "localizations": {
        "en": {
          "meaning": "ㅁ + ㅏ",
          "reading": "ma"
        }
      }
    }
  ],
  "localizations": {
    "en": {
      "name": "First Steps with Dubeolsik",
      "author_nickname": "typee Official",
      "tags": [
        "Beginner Basics",
        "Keyboard",
        "Official"
      ]
    },
    "ko": {
      "name": "두벌식 첫걸음",
      "author_nickname": "피요키 공식",
      "tags": [
        "입문",
        "키보드",
        "공식"
      ]
    }
  }
}
